Rank,EntryId,EntryName,TimeRemaining,Points,Lineup,,Player,%Drafted,FPTS
1,811682132,ADerr15,0,188.24,RB Kareem Hunt WR Adam Thielen DST Rams  QB Matt Ryan TE Delanie Walker WR Michael Crabtree WR Terrelle Pryor Sr. FLEX Kendall Wright RB David Johnson,,Zach Ertz,51.46%,17.3
2,812943588,lawdav101,0,179.76,RB Dalvin Cook WR Stefon Diggs DST Rams  QB Carson Palmer WR Michael Crabtree FLEX LeSean McCoy TE Zach Ertz RB Todd Gurley II WR Corey Coleman,,Todd Gurley II,39.81%,20.6
3,812201506,just10soccer,0,169.58,DST Rams  WR Larry Fitzgerald WR Antonio Brown WR Kendall Wright TE Zach Ertz FLEX Carlos Hyde RB David Johnson QB Carson Wentz RB Todd Gurley II,,Le'Veon Bell,38.83%,7.7
4,813067555,knovi91,0,164.3,FLEX Tyreek Hill RB Dalvin Cook DST Steelers  QB Eli Manning RB Jonathan Stewart WR Antonio Brown WR Cole Beasley TE Zach Ertz WR Amari Cooper,,David Johnson,33.01%,14.1
5,812356789,Archibus,0,163.76,WR Adam Thielen DST Rams  QB Carson Palmer WR Michael Crabtree RB LeSean McCoy FLEX Bilal Powell TE Zach Ertz RB David Johnson WR Cooper Kupp,,Kendall Wright,27.18%,6.4
6,811969724,OKEEFETA,0,160.94,QB Sam Bradford WR Stefon Diggs TE Coby Fleener DST Redskins  RB Bilal Powell WR Antonio Brown RB Devonta Freeman WR Davante Adams FLEX Jordan Howard,,Larry Fitzgerald,25.24%,13.4
7,811362091,kohlerm76,0,159.94,WR Adam Thielen DST Falcons  QB Matt Ryan RB LeSean McCoy RB Bilal Powell FLEX Antonio Brown TE Zach Ertz WR Davante Adams WR Corey Coleman,,Carlos Hyde,22.33%,13.7
8,810172972,gdaman15,0,159.72,RB Kareem Hunt TE Travis Kelce WR Chris Hogan RB Melvin Gordon DST Steelers  WR Golden Tate FLEX Terrelle Pryor Sr. WR Cole Beasley QB Dak Prescott,,Rams ,19.42%,28
9,812896544,Tr3m3ndous,0,157.74,FLEX C.J. Anderson DST Jaguars  WR Torrey Smith WR Antonio Brown WR Jermaine Kearse TE Zach Ertz RB David Johnson QB Marcus Mariota RB Todd Gurley II,,Michael Crabtree,18.45%,14.3
10,812417602,tiger99,0,157.44,WR Chris Hogan DST Rams  WR Michael Crabtree FLEX LeSean McCoy TE Zach Ertz WR DeAndre Hopkins QB Marcus Mariota RB Todd Gurley II RB Christian McCaffrey,,Chris Hogan,17.48%,3.5
11,812183754,puckembucky,0,157.14,WR Ted Ginn Jr. DST Rams  QB Aaron Rodgers FLEX Delanie Walker WR Antonio Brown WR Kendall Wright TE Zach Ertz RB Le'Veon Bell RB Todd Gurley II,,Antonio Brown,17.48%,32.2
12,810799363,nickhunter10,0,153.42,DST Broncos  WR Adam Thielen TE Delanie Walker QB Ben Roethlisberger WR Jeremy Maclin FLEX Pierre Garcon RB Bilal Powell WR Antonio Brown RB Todd Gurley II,,Carson Wentz,15.53%,23.88
13,811874450,tjl5124,0,152.18,WR Adam Thielen DST Rams  WR Larry Fitzgerald WR Kendall Wright TE Zach Ertz RB Le'Veon Bell FLEX Carlos Hyde RB David Johnson QB Carson Wentz,,Steelers ,15.53%,18
13,813124070,mrmoz555,0,152.18,WR Adam Thielen DST Rams  WR Larry Fitzgerald WR Kendall Wright TE Zach Ertz RB Le'Veon Bell FLEX Carlos Hyde RB David Johnson QB Carson Wentz,,Tom Brady,13.59%,10.68
15,813049793,FatGary74,0,149.68,RB C.J. Anderson RB Kareem Hunt QB Tom Brady FLEX James White WR Brandin Cooks WR Chris Hogan DST Falcons  WR Antonio Brown TE Zach Ertz,,Aaron Rodgers,13.59%,20.54
16,812767397,sranchntrucking,0,148.02,RB Dalvin Cook WR Stefon Diggs WR Adam Thielen DST Steelers  QB Ben Roethlisberger FLEX Eddie Lacy RB Le'Veon Bell WR Jordan Matthews TE Jesse James,,Christian McCaffrey,13.59%,12.5
17,812588536,TwineTickler,0,146.58,RB Dalvin Cook QB Tom Brady WR Chris Hogan DST Rams  WR Jordy Nelson WR Larry Fitzgerald TE Zach Ertz RB Todd Gurley II FLEX Christian McCaffrey,,LeSean McCoy,12.62%,23.9
18,812655346,jeffnwhit2,0,144.24,DST Steelers  TE Jason Witten QB Joe Flacco RB Marshawn Lynch WR Michael Crabtree WR Jeremy Maclin WR Antonio Brown FLEX Jordan Reed RB Todd Gurley II,,Doug Baldwin,12.62%,10
19,813042170,TheTracers,0,142.32,RB Dalvin Cook WR Stefon Diggs DST Rams  TE Delanie Walker QB Brian Hoyer WR Doug Baldwin WR Pierre Garcon RB Le'Veon Bell FLEX J.J. Nelson,,Delanie Walker,11.65%,14.6
20,811723578,Bmorg23,0,142.26,DST Rams  QB Carson Palmer WR Doug Baldwin WR Pierre Garcon FLEX Antonio Brown TE Jordan Reed RB Carlos Hyde RB Todd Gurley II WR Zay Jones,,Adam Thielen,11.65%,27.7
21,812987718,CraftyCam,0,141.98,DST Rams  WR Michael Crabtree WR Julio Jones FLEX Marvin Jones Jr. QB Derek Carr WR Amari Cooper RB Todd Gurley II TE Evan Engram RB Christian McCaffrey,,Texans ,10.68%,0
22,810204598,ccshrts,0,141.88,WR Ted Ginn Jr. DST Rams  WR Pierre Garcon WR Kendall Wright TE Zach Ertz RB Le'Veon Bell RB David Johnson QB Carson Wentz FLEX Todd Gurley II,,Jordan Howard,10.68%,15.6
23,812917247,bluminkrzy,0,138.64,QB Sam Bradford RB Dalvin Cook WR Adam Thielen DST Seahawks  WR Michael Crabtree FLEX Doug Baldwin WR A.J. Green RB Isaiah Crowell TE Evan Engram,,Julio Jones,9.71%,10.6
24,809634923,pughhenis,0,137.58,QB Tom Brady RB Mike Gillislee WR Chris Hogan RB Melvin Gordon DST Rams  TE Delanie Walker FLEX LeSean McCoy WR Rishard Matthews WR Martavis Bryant,,Pierre Garcon,8.74%,14.1
25,812101159,Derdy13,0,137.48,DST Eagles  WR Larry Fitzgerald WR Kendall Wright TE Zach Ertz RB Le'Veon Bell RB David Johnson WR Rishard Matthews QB Carson Wentz FLEX Todd Gurley II,,Davante Adams,8.74%,7.7
26,811980477,bacontacos,0,136.06,DST Rams  QB Carson Palmer WR Pierre Garcon WR John Brown TE Zach Ertz RB Le'Veon Bell RB Devonta Freeman FLEX Todd Gurley II WR Corey Coleman,,Lamar Miller,8.74%,11.6
27,813023276,pdemopo514,0,135.94,DST Steelers  QB Aaron Rodgers WR Larry Fitzgerald RB Marshawn Lynch TE Jimmy Graham FLEX Antonio Brown WR Randall Cobb RB Duke Johnson Jr. WR Corey Coleman,,Dalvin Cook,8.74%,19.7
28,812559436,richmurphy55,0,134.68,RB Kareem Hunt QB Tom Brady WR Ted Ginn Jr. DST Texans  RB LeSean McCoy WR Julio Jones TE Zach Ertz FLEX Robby Anderson WR Taylor Gabriel,,Amari Cooper,7.77%,17.2
29,810341392,Nexus,0,133.78,DST Jaguars  WR Larry Fitzgerald WR Torrey Smith WR Marvin Jones Jr. TE Zach Ertz RB Le'Veon Bell FLEX Carlos Hyde RB David Johnson QB Carson Wentz,,Isaiah Crowell,7.77%,10.6
30,812943036,KHoff,0,133.54,WR Tyreek Hill DST Steelers  QB Matt Ryan WR Larry Fitzgerald WR Marquise Goodwin RB Le'Veon Bell TE Nick Boyle FLEX Todd Gurley II RB Jordan Howard,,Broncos ,7.77%,5
31,810434780,moneyball_is_BS,0,133.48,DST Jaguars  FLEX Mike Tolbert TE Jared Cook WR Doug Baldwin QB Derek Carr WR Alshon Jeffery RB David Johnson WR Seth Roberts RB Ezekiel Elliott,,Derek Carr,7.77%,18.68
31,811813761,borrachocburro,0,133.48,RB Dalvin Cook WR Chris Hogan DST Rams  TE Delanie Walker WR Michael Crabtree WR Kendall Wright QB Derek Carr RB Le'Veon Bell FLEX Todd Gurley II,,Matt Ryan,7.77%,20.94
33,812551396,BigRags505,0,132.38,WR Stefon Diggs DST Eagles  WR Pierre Garcon QB Derek Carr RB Eddie Lacy RB Le'Veon Bell WR Amari Cooper TE Jesse James FLEX Kevin White,,Stefon Diggs,7.77%,27.7
34,813119189,persnickety,0,131.32,WR Keenan Allen DST Eagles  TE Delanie Walker WR Michael Crabtree QB Russell Wilson FLEX Carlos Hyde RB David Johnson WR Corey Coleman RB Christian McCaffrey,,Carson Palmer,7.77%,11.96
35,812829786,Intenzeplay,0,130.38,QB Tom Brady DST Lions  TE Jimmy Graham WR Antonio Brown FLEX Zach Ertz RB David Johnson WR Robby Anderson WR Cooper Kupp RB Christian McCaffrey,,Brandon Marshall,6.80%,2
36,812698396,bigmj88,0,128.78,DST Steelers  FLEX Martellus Bennett WR Michael Crabtree QB Derek Carr TE Zach Ertz RB Devonta Freeman WR Kelvin Benjamin WR Amari Cooper RB Todd Gurley II,,Brandin Cooks,6.80%,11.8
37,812813884,podunker,0,128.24,DST Rams  QB Aaron Rodgers WR Kendall Wright WR Randall Cobb TE Zach Ertz WR Marquise Goodwin FLEX Lamar Miller RB Le'Veon Bell RB David Johnson,,Devonta Freeman,6.80%,11.9
38,808493306,rpdakg,0,127.98,WR Chris Hogan DST Rams  WR Larry Fitzgerald WR Kendall Wright TE Zach Ertz RB Le'Veon Bell FLEX Carlos Hyde RB David Johnson QB Carson Wentz,,Jimmy Graham,6.80%,3.8
39,812908323,wrogers16,0,127.78,DST Bengals  WR Antonio Brown WR Kendall Wright TE Zach Ertz FLEX Lamar Miller RB David Johnson WR Allen Robinson QB Carson Wentz RB Jordan Howard,,Cardinals ,6.80%,8
40,809612466,lartuf,0,127.44,FLEX Danny Amendola DST Raiders  QB Aaron Rodgers WR Jordy Nelson TE Jimmy Graham WR Julio Jones RB Carlos Hyde RB Todd Gurley II WR Corey Coleman,,Falcons ,6.80%,5
41,812086101,MadFarmer,0,126.66,DST Rams  QB Carson Palmer WR John Brown RB David Johnson WR Paul Richardson WR Kelvin Benjamin RB Todd Gurley II FLEX Ezekiel Elliott TE Evan Engram,,Kelvin Benjamin,6.80%,3.5
42,807271220,Andersonia,0,126.58,QB Tom Brady WR Brandin Cooks WR Danny Amendola DST Steelers  WR Marvin Jones Jr. TE Zach Ertz RB Devonta Freeman FLEX Isaiah Crowell RB Jordan Howard,,A.J. Green,5.83%,12.4
43,813034139,rjacko17,0,126.38,WR Adam Thielen DST Cardinals  TE Zach Miller WR Michael Crabtree WR Mohamed Sanu QB Derek Carr FLEX Zach Ertz RB Le'Veon Bell RB David Johnson,,Corey Coleman,5.83%,16.3
44,811485034,birdies08,0,125.44,WR Emmanuel Sanders WR Stefon Diggs TE Kyle Rudolph DST Steelers  QB Aaron Rodgers RB Lamar Miller FLEX Carlos Hyde RB David Johnson WR Kevin White,,Rishard Matthews,5.83%,12.1
45,813020953,suslik11,0,125.4,DST Steelers  QB Kirk Cousins WR Kendall Wright TE Zach Ertz FLEX Le'Veon Bell WR DeAndre Hopkins WR Davante Adams RB Todd Gurley II RB Jordan Howard,,Martavis Bryant,5.83%,3.4
46,812870659,lorenl,0,124.84,DST Cardinals  QB Aaron Rodgers WR Larry Fitzgerald FLEX A.J. Green WR Kendall Wright TE Zach Ertz RB David Johnson WR Rishard Matthews RB Todd Gurley II,,Terrelle Pryor Sr.,5.83%,12.6
47,811826476,TheBigTicket,0,124.74,QB Sam Bradford WR Adam Thielen DST Bengals  TE Zach Miller RB Le'Veon Bell FLEX Carlos Hyde RB David Johnson WR Kelvin Benjamin WR Cooper Kupp,,Kirk Cousins,5.83%,13.6
48,811286166,flow30,0,124.68,WR Chris Hogan DST Texans  TE Delanie Walker WR Antonio Brown WR Kendall Wright RB Carlos Hyde RB David Johnson FLEX Todd Gurley II QB DeShone Kizer,,Evan Engram,5.83%,8.4
49,812866142,estarkey22,0,124.5,WR Tyreek Hill WR Brandin Cooks WR Keenan Allen DST Steelers  QB Eli Manning TE Jared Cook FLEX DeMarco Murray RB Lamar Miller RB Christian McCaffrey,,Kareem Hunt,4.85%,49.6
50,811992478,Theboozetraveler,0,124.28,DST Cardinals  WR Larry Fitzgerald RB LeSean McCoy WR Doug Baldwin WR Kendall Wright TE Zach Ertz RB Le'Veon Bell FLEX Carlos Hyde QB Carson Wentz,,Marshawn Lynch,4.85%,10.2
50,812950747,patsfan0925,0,124.28,DST Cardinals  WR Larry Fitzgerald RB LeSean McCoy WR Doug Baldwin WR Kendall Wright TE Zach Ertz RB Le'Veon Bell FLEX Carlos Hyde QB Carson Wentz,,Jordy Nelson,4.85%,20.9
52,812656310,55MAZZ55,0,122.74,QB Sam Bradford DST Steelers  RB Matt Forte TE Martellus Bennett WR Julio Jones WR Cole Beasley FLEX Davante Adams WR Amari Cooper RB Todd Gurley II,,Ted Ginn Jr.,4.85%,9.8
53,811931992,joegibbs19,0,122.64,WR Brandin Cooks FLEX Coby Fleener DST Bengals  QB Aaron Rodgers WR Doug Baldwin WR Jermaine Kearse TE Zach Ertz RB David Johnson RB Jordan Howard,,Ben Roethlisberger,4.85%,16.72
54,813087745,bdad1021,0,122.48,DST Panthers  WR Michael Crabtree FLEX DeMarco Murray WR Doug Baldwin TE Charles Clay QB Derek Carr WR DeAndre Hopkins RB Ameer Abdullah RB Jordan Howard,,Eddie Lacy,4.85%,0.3
55,807249516,gqinxs,0,121.78,WR Chris Hogan DST Texans  FLEX Brandon Marshall WR Larry Fitzgerald RB LeSean McCoy TE Zach Ertz QB Carson Wentz WR Amari Cooper RB Todd Gurley II,,Bilal Powell,4.85%,8.9
56,810187481,chameleon559,0,120.38,QB Tom Brady WR Chris Hogan WR Keenan Allen DST Panthers  RB Frank Gore WR Golden Tate FLEX John Brown RB David Johnson TE Austin Hooper,,Sam Bradford,4.85%,28.54
57,812966399,karbach,0,120.26,DST Falcons  QB Carson Palmer TE Delanie Walker WR Larry Fitzgerald RB LeSean McCoy WR Doug Baldwin FLEX Zach Ertz WR Kelvin Benjamin RB Todd Gurley II,,Marcus Mariota,4.85%,18.84
58,809387177,Beelio24,0,119.18,QB Tom Brady WR Chris Hogan WR Danny Amendola DST Ravens  TE Zach Ertz RB Le'Veon Bell RB David Johnson WR Paul Richardson FLEX Sterling Shepard,,DeMarco Murray,4.85%,8
59,812877256,DFS_HofbrauKing,0,117.94,FLEX C.J. Anderson DST Bengals  WR Brandon Marshall QB Aaron Rodgers WR Antonio Brown WR Kendall Wright TE Zach Ertz RB Lamar Miller RB David Johnson,,Marvin Jones Jr.,3.88%,11.7
60,813025618,SKTT1Bang,0,117.32,WR Stefon Diggs DST Texans  WR Michael Crabtree WR Doug Baldwin QB Russell Wilson TE Zach Ertz FLEX Isaiah Crowell RB Jordan Howard RB Christian McCaffrey,,Travis Kelce,3.88%,9.4
61,813085672,bighitfrom20,0,117.18,DST Vikings  WR Brandon Marshall WR Larry Fitzgerald RB LeSean McCoy WR Kendall Wright TE Zach Ertz RB Le'Veon Bell QB Carson Wentz FLEX Todd Gurley II,,Robby Anderson,3.88%,6.2
61,813109511,gsd4,0,117.18,DST Vikings  WR Brandon Marshall WR Larry Fitzgerald RB LeSean McCoy WR Kendall Wright TE Zach Ertz RB Le'Veon Bell QB Carson Wentz FLEX Todd Gurley II,,Sterling Shepard,3.88%,12
63,812845363,Kylecunn,0,117,FLEX Brandin Cooks DST Steelers  WR Jeremy Maclin RB LeSean McCoy QB Kirk Cousins WR Terrelle Pryor Sr. WR Kevin White TE Evan Engram RB Christian McCaffrey,,Mike Gillislee,3.88%,22.5
64,812217593,TylerTheCarroll,0,116.62,TE Travis Kelce FLEX Coby Fleener DST Bills  QB Ben Roethlisberger RB Marshawn Lynch WR Antonio Brown RB Lamar Miller WR Jamison Crowder WR Davante Adams,,Keenan Allen,3.88%,14.5
65,811419334,antonino_derosa,0,115.54,DST Cardinals  QB Aaron Rodgers WR Larry Fitzgerald WR Doug Baldwin WR Kendall Wright TE Zach Ertz RB Lamar Miller RB Le'Veon Bell FLEX Todd Gurley II,,Jared Cook,3.88%,10.6
66,812156502,wackanation,0,115.44,FLEX Adam Thielen DST Texans  WR Larry Fitzgerald WR Kendall Wright TE Zach Ertz RB Le'Veon Bell WR Kelvin Benjamin QB Marcus Mariota RB Todd Gurley II,,Bills ,3.88%,9
67,812879441,alanlewis501,0,115.34,WR Michael Thomas DST Packers  QB Matt Ryan TE Delanie Walker WR Eric Decker RB DeMarco Murray WR Randall Cobb FLEX Ty Montgomery RB Christian McCaffrey,,Eric Decker,3.88%,4
68,813042361,lohnez,0,113.24,QB Sam Bradford FLEX Dalvin Cook WR Chris Hogan DST Texans  TE Greg Olsen WR Larry Fitzgerald WR Doug Baldwin RB Carlos Hyde RB Todd Gurley II,,Kevin White,3.88%,2.6
69,807319726,AnthonyGom4,0,112.38,RB Kareem Hunt TE Travis Kelce QB Tom Brady FLEX Dwayne Allen DST Patriots  RB Marshawn Lynch WR Dez Bryant WR A.J. Green WR Terrance Williams,,Bengals ,3.88%,4
70,812556236,Winner476,0,110.14,DST Broncos  WR Stefon Diggs QB Matt Ryan WR Pierre Garcon TE Tyler Eifert RB Carlos Hyde RB David Johnson FLEX Isaiah Crowell WR Kevin White,,Zach Miller,3.88%,7.9
71,811959503,chobson1962,0,109.64,DST 49ers  QB Matt Ryan WR Jordy Nelson RB Darren McFadden TE Jimmy Graham WR Michael Crabtree FLEX Charles Clay WR DeAndre Hopkins RB Devonta Freeman,,Cooper Kupp,3.88%,17.6
72,813003647,aintnobodygottime4,0,109.44,DST Rams  QB Aaron Rodgers TE Jimmy Graham WR Kendall Wright RB Le'Veon Bell FLEX Carlos Hyde RB David Johnson WR Rishard Matthews WR Zay Jones,,Coby Fleener,3.88%,16.4
73,812869163,Jimh5891,0,109.34,DST Broncos  RB Melvin Gordon TE Jason Witten FLEX Marshawn Lynch WR Michael Crabtree QB Cam Newton WR T.Y. Hilton WR Davante Adams RB Christian McCaffrey,,DeAndre Hopkins,3.88%,18.5
74,812851074,MoneyTrain18,0,108.98,DST Broncos  WR Brandon Marshall WR Kendall Wright TE Zach Ertz RB Le'Veon Bell RB David Johnson QB Carson Wentz WR Sterling Shepard FLEX Todd Gurley II,,Allen Robinson,3.88%,2.7
75,811032580,SemperFri,0,108.8,DST Bills  WR Eric Decker WR Michael Crabtree QB Kirk Cousins WR Marvin Jones Jr. TE Zach Ertz RB Le'Veon Bell RB Isaiah Crowell FLEX Todd Gurley II,,Jamison Crowder,3.88%,3.4
76,812767328,redraiderbt,0,108.48,DST 49ers  WR Michael Crabtree FLEX Danny Woodhead WR Pierre Garcon WR Kendall Wright TE Zach Ertz RB Le'Veon Bell RB David Johnson QB Carson Wentz,,Rob Gronkowski,3.88%,5.3
77,813100824,MyYear18,0,107.34,RB Dalvin Cook FLEX James White WR Brandin Cooks DST Falcons  RB Matt Forte TE Jared Cook WR Terrelle Pryor Sr. WR A.J. Green QB Marcus Mariota,,Danny Amendola,2.91%,19
78,810934674,The-Vigilantes,0,107.08,WR Chris Hogan WR Ted Ginn Jr. DST Cardinals  WR Larry Fitzgerald TE Zach Ertz RB Le'Veon Bell FLEX Carlos Hyde RB David Johnson QB DeShone Kizer,,Paul Richardson,2.91%,9.9
79,812646680,gobluesmo,0,107.06,FLEX Rob Gronkowski DST Steelers  QB Carson Palmer TE Zach Ertz WR Martavis Bryant WR Sammy Watkins RB Isaiah Crowell WR Amari Cooper RB Christian McCaffrey,,Melvin Gordon,2.91%,18.9
80,813023709,crodzilla,0,105.22,WR Adam Thielen TE Kyle Rudolph WR Chris Hogan DST Texans  WR Doug Baldwin QB Russell Wilson RB Devonta Freeman RB Isaiah Crowell FLEX Todd Gurley II,,Cole Beasley,2.91%,6.2
81,812842154,poolboy17,0,104.84,DST Colts  QB Aaron Rodgers WR Pierre Garcon WR Julio Jones WR Kendall Wright TE Zach Ertz RB Le'Veon Bell RB Carlos Hyde FLEX Christian McCaffrey,,John Brown,2.91%,8.2
82,810247402,tonydagod0007,0,104.78,QB Tom Brady DST Saints  WR Keenan Allen TE Delanie Walker WR Brandon LaFell FLEX Theo Riddick RB Carlos Hyde RB David Johnson WR Amari Cooper,,Jaguars ,2.91%,28
83,813109969,tjstout,0,104.54,DST Broncos  WR Michael Crabtree QB Cam Newton TE Zach Ertz RB Le'Veon Bell WR Rishard Matthews WR Paul Richardson FLEX Kelvin Benjamin RB Todd Gurley II,,49ers ,2.91%,4
84,813035662,rombuticus,0,103.68,WR Emmanuel Sanders TE Coby Fleener DST Bills  WR Julio Jones QB Derek Carr WR Allen Robinson FLEX Paul Perkins RB Todd Gurley II RB Jordan Howard,,Alshon Jeffery,2.91%,8.8
85,811424609,THEROBBOB20,0,101.38,TE Travis Kelce WR Ted Ginn Jr. DST Browns  WR Larry Fitzgerald WR Kendall Wright RB Le'Veon Bell FLEX Carlos Hyde RB David Johnson QB Carson Wentz,,Ezekiel Elliott,2.91%,22
86,810344250,saltydawgs66,0,101.1,WR Brandin Cooks DST 49ers  WR Larry Fitzgerald TE Jimmy Graham QB Kirk Cousins RB Isaiah Crowell WR Davante Adams RB Todd Gurley II FLEX Jordan Howard,,Jeremy Maclin,2.91%,13.6
87,807946787,webb5008,0,100.34,WR Chris Hogan DST Jets  QB Aaron Rodgers WR Kendall Wright TE Zach Ertz RB Le'Veon Bell RB David Johnson WR Robby Anderson FLEX Todd Gurley II,,Emmanuel Sanders,2.91%,5.6
88,812239468,Kinghorse45,0,99.94,DST Falcons  WR Eric Decker WR Julio Jones TE Zach Ertz FLEX Martavis Bryant QB Marcus Mariota WR Davante Adams RB Todd Gurley II RB Christian McCaffrey,,Cam Newton,2.91%,14.14
89,811487651,billyp69,0,99.14001,WR Chris Hogan DST Steelers  WR Jordy Nelson QB Cam Newton FLEX A.J. Green RB Jay Ajayi WR Sterling Shepard RB Tevin Coleman TE Evan Engram,,Eagles ,2.91%,22
90,812510360,uauttaknow,0,98.53999,DST Steelers  QB Matt Ryan WR Julio Jones WR Jaron Brown TE Vance McDonald FLEX Zach Ertz RB Le'Veon Bell WR Jamison Crowder RB Todd Gurley II,,Randall Cobb,2.91%,17.5
91,810397960,smoakeey,0,98.12,DST Broncos  QB Ben Roethlisberger TE Jared Cook WR Antonio Brown RB Ryan Mathews RB Le'Veon Bell WR Rishard Matthews FLEX Tevin Coleman WR Devin Funchess,,Tyreek Hill,2.91%,29.8
92,812212625,thacarpetking,0,96.8,WR Michael Thomas DST Falcons  QB Kirk Cousins TE Zach Ertz RB David Johnson FLEX Ameer Abdullah WR Jamison Crowder WR Robby Anderson RB Todd Gurley II,,C.J. Anderson,2.91%,9.8
93,810772934,straightouttavegas,0,95.89999,DST Broncos  RB Mike Gillislee WR Chris Hogan WR Larry Fitzgerald QB Kirk Cousins WR Terrelle Pryor Sr. TE Zach Ertz FLEX Eddie Lacy RB Le'Veon Bell,,Russell Wilson,2.91%,9.32
94,812072437,paulsmith_3,0,94.73999,DST Cardinals  QB Aaron Rodgers TE Zach Miller WR Julio Jones RB Lamar Miller FLEX Le'Veon Bell RB Carlos Hyde WR Allen Robinson WR Sterling Shepard,,Vikings ,2.91%,2
95,812836731,flamethrowers,0,93.02,WR Emmanuel Sanders DST Broncos  FLEX Zach Miller QB Ben Roethlisberger TE Zach Ertz WR Alshon Jeffery RB Le'Veon Bell WR Martavis Bryant RB Todd Gurley II,,James White,2.91%,9.8
96,811749348,keonip11,0,92.64,DST Texans  WR Brandon Marshall QB Aaron Rodgers TE Delanie Walker WR Larry Fitzgerald WR Michael Crabtree FLEX Kendall Wright RB Le'Veon Bell RB Carlos Hyde,,Dez Bryant,1.94%,6.3
97,812940167,jarrco,0,91.84,RB Adrian Peterson DST Falcons  WR Brandon Marshall QB Matt Ryan WR Larry Fitzgerald FLEX Bilal Powell WR Julio Jones TE Zach Ertz RB Devonta Freeman,,Golden Tate,1.94%,24.4
98,811695135,4chinKing,0,91.58,FLEX Chris Conley QB Tom Brady DST Texans  WR Larry Fitzgerald WR Dez Bryant RB Carlos Hyde WR Sammy Watkins RB Ezekiel Elliott TE Evan Engram,,Panthers ,1.94%,15
99,813035085,aludwig25,0,85.08,QB Tom Brady TE Rob Gronkowski DST Texans  RB Lamar Miller WR Jamison Crowder WR Martavis Bryant FLEX Todd Gurley II WR Cooper Kupp RB Christian McCaffrey,,Torrey Smith,1.94%,4
100,813042922,lingus77,0,83.57999,DST Vikings  QB Tom Brady RB James White WR Eric Decker TE Zach Ertz WR Alshon Jeffery RB Le'Veon Bell WR Davante Adams FLEX Jordan Howard,,Tevin Coleman,1.94%,9.8
101,812991266,Immaculate11,0,83.42,WR Chris Conley RB Mike Gillislee TE Rob Gronkowski DST Bills  WR Jordy Nelson QB Brian Hoyer RB DeMarco Murray FLEX Kelvin Benjamin WR Allen Robinson,,DeShone Kizer,1.94%,19.58
102,813045119,Schor,0,81.16,DST Chiefs  RB Darren Sproles QB Carson Palmer TE Jimmy Graham FLEX DeMarco Murray WR Antonio Brown WR A.J. Green RB Eddie Lacy WR Josh Doctson,,Kyle Rudolph,1.94%,11.6
103,813086611,mannydvs,0,60.08,QB Tom Brady RB Mike Gillislee WR Chris Hogan TE Rob Gronkowski FLEX Adrian Peterson DST Texans  WR Terrelle Pryor Sr. RB Eddie Lacy WR Martavis Bryant,,Chris Conley,1.94%,6.3
,,,,,,,Sammy Watkins,1.94%,10.8
,,,,,,,Jordan Reed,1.94%,8.6
,,,,,,,Zay Jones,1.94%,3.1
,,,,,,,Jermaine Kearse,1.94%,12.9
,,,,,,,Charles Clay,1.94%,15.3
,,,,,,,Michael Thomas,1.94%,9.5
,,,,,,,Ameer Abdullah,1.94%,7.1
,,,,,,,Jesse James,1.94%,22.1
,,,,,,,Jason Witten,1.94%,18.9
,,,,,,,Matt Forte,1.94%,6.6
,,,,,,,Martellus Bennett,1.94%,7.3
,,,,,,,Marquise Goodwin,1.94%,5.1
,,,,,,,Eli Manning,1.94%,7.7
,,,,,,,Adrian Peterson,1.94%,1.8
,,,,,,,Brian Hoyer,1.94%,5.22
,,,,,,,Dwayne Allen,0.97%,0
,,,,,,,Patriots ,0.97%,1
,,,,,,,Terrance Williams,0.97%,12.8
,,,,,,,Jets ,0.97%,4
,,,,,,,Ravens ,0.97%,25
,,,,,,,Raiders ,0.97%,2
,,,,,,,Dak Prescott,0.97%,17.12
,,,,,,,Frank Gore,0.97%,6.2
,,,,,,,Austin Hooper,0.97%,23.8
,,,,,,,Saints ,0.97%,0
,,,,,,,Brandon LaFell,0.97%,5.4
,,,,,,,Theo Riddick,0.97%,14.6
,,,,,,,Ryan Mathews,0.97%,0
,,,,,,,Devin Funchess,0.97%,4
,,,,,,,Mike Tolbert,0.97%,12.4
,,,,,,,Seth Roberts,0.97%,8.9
,,,,,,,Browns ,0.97%,3
,,,,,,,Jay Ajayi,0.97%,0
,,,,,,,Darren McFadden,0.97%,0
,,,,,,,Redskins ,0.97%,12
,,,,,,,Jaron Brown,0.97%,0
,,,,,,,Vance McDonald,0.97%,0
,,,,,,,Tyler Eifert,0.97%,1.4
,,,,,,,Taylor Gabriel,0.97%,6.6
,,,,,,,Joe Flacco,0.97%,7.84
,,,,,,,Danny Woodhead,0.97%,6.7
,,,,,,,Jordan Matthews,0.97%,8.1
,,,,,,,Lions ,0.97%,16
,,,,,,,Colts ,0.97%,2
,,,,,,,T.Y. Hilton,0.97%,7.7
,,,,,,,Packers ,0.97%,9
,,,,,,,Ty Montgomery,0.97%,19.3
,,,,,,,Seahawks ,0.97%,7
,,,,,,,Nick Boyle,0.97%,2.4
,,,,,,,Duke Johnson Jr.,0.97%,4
,,,,,,,Mohamed Sanu,0.97%,10.7
,,,,,,,Paul Perkins,0.97%,4.5
,,,,,,,J.J. Nelson,0.97%,15.3
,,,,,,,Greg Olsen,0.97%,3.8
,,,,,,,Chiefs ,0.97%,3
,,,,,,,Darren Sproles,0.97%,9.5
,,,,,,,Josh Doctson,0.97%,0
,,,,,,,Jonathan Stewart,0.97%,16.2
